{
  "version": "1.0",
  "metadata": {
    "description": "Agent-Dialog-Konfiguration für AXIOM Leitfaden",
    "created": "2025-09-29",
    "agent_name": "Spürhund Rex",
    "selector_system": "CSS-Selectors mit data-ref Attributen"
  },
  
  "dialogs": {
    "format-decision": {
      "id": "format-decision",
      "title": "Format-Entscheidungshilfe",
      "description": "Hilft bei der Wahl zwischen HTML, PDF und XLSX",
      "targetSelectors": [
        "#section-step2",
        "#section-step2 [data-ref='format-options']"
      ],
      "initialMessage": "<p>Wuff! 🐕‍🦺 Ich sehe, Sie müssen ein Report-Format wählen.</p><p>Lassen Sie mich Ihnen helfen! Wofür benötigen Sie den Report?</p>",
      "actions": [
        {
          "id": "chat-analysis",
          "type": "showInfo",
          "icon": "💬",
          "label": "Chat-Analysen und interaktive Darstellung",
          "content": "<p>Perfekt! Für Chat-Analysen ist <strong>HTML</strong> die beste Wahl! 🎯</p><p>HTML-Reports bieten:</p><ul><li>✅ Interaktive Navigation</li><li>✅ Chat-Thread Darstellung</li><li>✅ Hyperlinks zwischen Beweisen</li><li>✅ UTF-8 Support für mehrsprachige Inhalte</li></ul>",
          "nextActions": [
            {
              "id": "navigate-to-html",
              "type": "navigate",
              "icon": "🎯",
              "label": "Zu HTML-Format springen",
              "targetSelectors": ["#section-step2 [data-ref='format-html']"],
              "scrollBehavior": "smooth",
              "highlightDuration": 2000,
              "contextBlock": {
                "targetSelector": "#section-step2 [data-ref='agent-context']",
                "content": "<div class='agent-context-header'><span class='agent-context-icon'>🐕‍🦺</span><h4 class='agent-context-title'>Rex' Expertentipp</h4><button class='agent-context-close' onclick='hideContextBlock(\"#section-step2 [data-ref=\\\"agent-context\\\"]\")' aria-label='Tipp schließen'>✕</button></div><div class='agent-context-content'><p><strong>Rex' Expertentipp:</strong> Bei Chat-Daten aus WhatsApp, Telegram oder Signal ist HTML unschlagbar, weil die Threading-Struktur erhalten bleibt und Emojis korrekt dargestellt werden.</p></div>"
              }
            }
          ]
        },
        {
          "id": "court-reports",
          "type": "showInfo",
          "icon": "⚖️",
          "label": "Gerichtsberichte und offizielle Dokumentation",
          "content": "<p>Ah, für offizielle Zwecke! Dann empfehle ich <strong>PDF</strong>. 📄</p><p>PDF-Reports sind:</p><ul><li>✅ Unveränderbar und gerichtsfest</li><li>✅ Druckoptimiert</li><li>✅ Plattformunabhängig</li><li>✅ Mit automatischem Inhaltsverzeichnis</li></ul>",
          "nextActions": [
            {
              "id": "navigate-to-pdf",
              "type": "navigate", 
              "icon": "📚",
              "label": "Mehr über PDF-Export erfahren",
              "targetSelectors": ["#section-step2 [data-ref='format-pdf']"],
              "contextBlock": {
                "targetSelector": "#section-step2 [data-ref='agent-context']",
                "content": "<div class='agent-context-header'><span class='agent-context-icon'>🐕‍🦺</span><h4 class='agent-context-title'>Rex' PDF-Tipp</h4><button class='agent-context-close' onclick='hideContextBlock(\"#section-step2 [data-ref=\\\"agent-context\\\"]\")' aria-label='Tipp schließen'>✕</button></div><div class='agent-context-content'><p><strong>PDF für Gerichte:</strong> PDF-Reports sind unveränderbar und damit gerichtsfest. Sie eignen sich perfekt für finale Dokumentation und offizielle Berichte.</p></div>"
              }
            }
          ]
        },
        {
          "id": "data-analysis",
          "type": "showInfo",
          "icon": "📊",
          "label": "Datenanalyse und Timeline-Auswertung",
          "content": "<p>Ausgezeichnet für Analysen! Wählen Sie <strong>XLSX</strong>. 📈</p><p>XLSX-Exports ermöglichen:</p><ul><li>✅ Timeline-Analysen</li><li>✅ Filterbare Tabellen</li><li>✅ Statistische Auswertungen</li><li>✅ Weiterverarbeitung in Excel</li></ul>",
          "nextActions": [
            {
              "id": "navigate-to-xlsx",
              "type": "navigate",
              "icon": "📊", 
              "label": "Zu Excel-Export Details",
              "targetSelectors": ["#section-step2 [data-ref='format-xlsx']"],
              "contextBlock": {
                "targetSelector": "#section-step2 [data-ref='agent-context']",
                "content": "<div class='agent-context-header'><span class='agent-context-icon'>🐕‍🦺</span><h4 class='agent-context-title'>Rex' Excel-Tipp</h4><button class='agent-context-close' onclick='hideContextBlock(\"#section-step2 [data-ref=\\\"agent-context\\\"]\")' aria-label='Tipp schließen'>✕</button></div><div class='agent-context-content'><p><strong>XLSX für Analysen:</strong> Excel-Exports sind ideal für Timeline-Analysen und statistische Auswertungen. Sie können die Daten filtern, sortieren und grafisch darstellen.</p></div>"
              }
            }
          ]
        }
      ],
      "questions": {
        "why-html": {
          "id": "why-html",
          "message": "<p>Gute Frage! 🤔 HTML ist ideal weil:</p><ul><li>Interaktive Links zwischen Beweisen</li><li>Chat-Threads bleiben strukturiert</li><li>Emojis und Sonderzeichen funktionieren perfekt</li><li>Durchsuchbar im Browser</li></ul><p>Soll ich Ihnen zeigen, wie man HTML auswählt?</p>",
          "actions": [
            {
              "id": "show-html-selection",
              "type": "navigate",
              "icon": "✅",
              "label": "Ja, zeig mir wie!",
              "targetSelectors": ["#section-step2 [data-ref='explanation-text']"],
              "scrollBehavior": "smooth"
            },
            {
              "id": "ask-about-pdf", 
              "type": "askQuestion",
              "icon": "❓",
              "label": "Was ist mit PDF?",
              "question": "<p>PDF ist super für offizielle Dokumente! Soll ich mehr darüber erzählen?</p>",
              "actions": [
                {
                  "id": "explain-pdf",
                  "type": "showInfo",
                  "icon": "📄",
                  "label": "Ja, erkläre PDF",
                  "content": "<p>PDF-Reports sind unveränderbar und perfekt für Gerichte. Sie bieten:</p><ul><li>Gerichtsfeste Dokumentation</li><li>Druckoptimierte Darstellung</li><li>Plattformunabhängige Anzeige</li><li>Automatisches Inhaltsverzeichnis</li></ul>"
                }
              ]
            }
          ]
        }
      }
    },

    "export-start-help": {
      "id": "export-start-help", 
      "title": "Export-Start Hilfe",
      "description": "Hilft beim Start des HTML-Report-Exports",
      "targetSelectors": [
        "#section-workflow [data-ref='step1-basic']",
        "#section-workflow [data-ref='step1-standard']"
      ],
      "initialMessage": "<p>Wuff! 🐕‍🦺 Ich helfe Ihnen beim Export-Start!</p><p>Es gibt zwei Wege, um einen HTML-Report zu erstellen. Welcher Weg interessiert Sie?</p>",
      "actions": [
        {
          "id": "main-menu-path",
          "type": "showInfo",
          "icon": "📋",
          "label": "Hauptmenü-Weg (Datei → Bericht/Export)",
          "content": "<p>Der klassische Weg über das Hauptmenü:</p><ol><li><strong>Datei</strong> → <strong>Bericht/Export erstellen</strong></li><li>Funktioniert von überall in AXIOM</li><li>Alle Beweise stehen zur Auswahl</li></ol><p>Dieser Weg ist standardisiert und immer verfügbar! 📂</p>",
          "nextActions": [
            {
              "id": "show-menu-details",
              "type": "navigate",
              "icon": "🔍",
              "label": "Mehr Details anzeigen",
                              "targetSelectors": ["#section-workflow [data-ref='step1-menu-path']"]
            }
          ]
        },
        {
          "id": "context-menu-path",
          "type": "showInfo", 
          "icon": "🎯",
          "label": "Kontextmenü-Weg (Rechtsklick auf Beweise)",
          "content": "<p>Der effiziente Weg mit Vorauswahl:</p><ol><li>Beweise im <strong>Artifacts Explorer</strong> markieren</li><li><strong>Rechtsklick</strong> → <strong>Bericht/Export erstellen</strong></li><li>Ausgewählte Beweise sind bereits vorselektiert</li></ol><p>Zeitersparnis durch gezielte Auswahl! ⚡</p>",
          "nextActions": [
            {
              "id": "show-context-details",
              "type": "navigate",
              "icon": "🔍", 
              "label": "Mehr Details anzeigen",
                              "targetSelectors": ["#section-workflow [data-ref='step1-context-path']"]
            }
          ]
        },
        {
          "id": "best-practice-tip",
          "type": "showInfo",
          "icon": "💡",
          "label": "Best Practice: Beweise taggen",
          "content": "<p><strong>Rex' Profi-Tipp:</strong> Taggen Sie wichtige Beweise VOR dem Export! 🏷️</p><p>Warum das smart ist:</p><ul><li>Option 'Only tagged items' nutzen</li><li>Fokussierte Reports erstellen</li><li>Zeit bei der Auswahl sparen</li><li>Konsistente Ergebnisse</li></ul>",
          "nextActions": [
            {
              "id": "show-tip-details",
              "type": "navigate",
              "icon": "💡",
              "label": "Tip-Details anzeigen", 
                              "targetSelectors": ["#section-workflow [data-ref='step1-tip']"]
            }
          ]
        }
      ],
      "questions": {
        "export-methods": {
          "id": "export-methods",
          "message": "<p>Welche Export-Methode ist für Sie am besten geeignet? 🤔</p>",
          "expectInput": true,
          "inputPlaceholder": "Beschreiben Sie Ihre Situation...",
          "fallbackActions": [
            {
              "id": "general-guidance",
              "type": "showInfo",
              "icon": "🎯",
              "label": "Allgemeine Empfehlung",